{
 "versao": 1,
 "objeto": "x_press_coffee",
 "rodada": 1,
 "nota_arte": 8,
 "nota_realista": 7,
 "pecas": [
  {
   "nome": "base",
   "situacao": "ok"
  },
  {
   "nome": "coluna",
   "situacao": "ok"
  },
  {
   "nome": "cabeca",
   "situacao": "ok"
  },
  {
   "nome": "tampa",
   "situacao": "ok"
  },
  {
   "nome": "bico",
   "situacao": "ok"
  }
 ],
 "defeitos": [
  {
   "parte": "tampa",
   "tipo": "cor",
   "nivel": "realista",
   "vista": "zoom",
   "angulo": 0,
   "onde": "metade traseira do topo da tampa arredondada (tampa_frente)",
   "sentido": "",
   "evidencia": "zoom.png 000 e 045: faixa preta sólida no topo da tampa que não existe no desenho do jogo",
   "gravidade": "media"
  },
  {
   "parte": "base",
   "tipo": "cor",
   "nivel": "realista",
   "vista": "zoom",
   "angulo": 45,
   "onde": "superfície superior da base ao redor da metade traseira do prato",
   "sentido": "",
   "evidencia": "zoom.png 000 e 045: arco preto sólido contornando o prato na base, ausente no desenho original",
   "gravidade": "media"
  },
  {
   "parte": "cabeca",
   "tipo": "cor",
   "nivel": "realista",
   "vista": "comparacao",
   "angulo": 0,
   "onde": "corpo da cabeça, tampa e base",
   "sentido": "",
   "evidencia": "comparacao.png 000: tom cinza claro do modelo realista destoa do cinza escuro/chumbo do sprite original",
   "gravidade": "leve"
  },
  {
   "parte": "coluna",
   "tipo": "textura_deslocada",
   "nivel": "arte",
   "vista": "giro",
   "angulo": 90,
   "onde": "face lateral da coluna e lateral da cabeça",
   "sentido": "",
   "evidencia": "giro_arte.png 090 e 135: mancha clara na parte inferior da lateral da coluna e faixa escura na lateral da cabeça",
   "gravidade": "leve"
  }
 ],
 "observacao": "Excelente geometria e correspondência em 0°/180° na arte; o nível realista precisa apenas corrigir as duas áreas pretas na tampa e na base e escurecer um pouco o tom cinza."
}
